{
  "$schema": "https://json-schema.org/draft/2020-12/schema",
  "$id": "https://github.com/yashtri/ruffnut/templates/schema/program-template.schema.json",
  "title": "ruffnut program template",
  "type": "object",
  "additionalProperties": false,
  "required": ["name", "version", "workouts"],
  "properties": {
    "name": {
      "type": "string",
      "minLength": 1
    },
    "description": {
      "type": "string"
    },
    "version": {
      "type": "integer",
      "const": 1
    },
    "workouts": {
      "type": "array",
      "minItems": 1,
      "items": {
        "type": "object",
        "additionalProperties": false,
        "required": ["name", "exercises"],
        "properties": {
          "name": {
            "type": "string",
            "minLength": 1
          },
          "exercises": {
            "type": "array",
            "minItems": 1,
            "items": {
              "type": "object",
              "additionalProperties": false,
              "required": ["name"],
              "properties": {
                "name": {
                  "type": "string",
                  "minLength": 1
                },
                "sets": {
                  "type": "integer",
                  "minimum": 0
                },
                "reps": {
                  "type": "integer",
                  "minimum": 0
                }
              }
            }
          }
        }
      }
    }
  }
}
