{
  "name": "Bro Split",
  "description": "Five-day split targeting one major muscle group per session",
  "version": 1,
  "workouts": [
    {
      "name": "Chest",
      "exercises": [
        { "name": "Bench Press", "sets": 4, "reps": 8 },
        { "name": "Incline Dumbbell Press", "sets": 3, "reps": 10 },
        { "name": "Cable Fly", "sets": 3, "reps": 12 },
        { "name": "Dips", "sets": 3, "reps": 10 },
        { "name": "Push-Up", "sets": 2, "reps": 15 }
      ]
    },
    {
      "name": "Back",
      "exercises": [
        { "name": "Deadlift", "sets": 4, "reps": 6 },
        { "name": "Pull-Up", "sets": 4, "reps": 8 },
        { "name": "Barbell Row", "sets": 3, "reps": 10 },
        { "name": "Lat Pulldown", "sets": 3, "reps": 12 },
        { "name": "Seated Cable Row", "sets": 3, "reps": 12 }
      ]
    },
    {
      "name": "Shoulders",
      "exercises": [
        { "name": "Overhead Press", "sets": 4, "reps": 8 },
        { "name": "Lateral Raise", "sets": 4, "reps": 15 },
        { "name": "Rear Delt Fly", "sets": 3, "reps": 15 },
        { "name": "Front Raise", "sets": 3, "reps": 12 },
        { "name": "Shrug", "sets": 3, "reps": 12 }
      ]
    },
    {
      "name": "Arms",
      "exercises": [
        { "name": "Barbell Curl", "sets": 4, "reps": 10 },
        { "name": "Close-Grip Bench Press", "sets": 4, "reps": 10 },
        { "name": "Hammer Curl", "sets": 3, "reps": 12 },
        { "name": "Tricep Pushdown", "sets": 3, "reps": 12 },
        { "name": "Preacher Curl", "sets": 3, "reps": 12 },
        { "name": "Overhead Tricep Extension", "sets": 3, "reps": 12 }
      ]
    },
    {
      "name": "Legs",
      "exercises": [
        { "name": "Back Squat", "sets": 4, "reps": 8 },
        { "name": "Romanian Deadlift", "sets": 3, "reps": 10 },
        { "name": "Leg Press", "sets": 3, "reps": 12 },
        { "name": "Leg Curl", "sets": 3, "reps": 12 },
        { "name": "Leg Extension", "sets": 3, "reps": 12 },
        { "name": "Standing Calf Raise", "sets": 4, "reps": 15 }
      ]
    }
  ]
}